source,asin,block_index,review_id,reviewer_name,rating,rating_raw,title,title_language,review_text,review_language,review_date_raw,variant_raw,verified_purchase,helpful_votes_raw,source_url,collected_at_utc,dedup_key
amazon,B008JGIZGS,1,R16B8CAHBV2RT6,Harley,5.0,5 out of 5 stars,"Delicious, Nutritious, and Full of Proteins and 24 Vitamins & Minerals !!",en-US,"The Premier Protein Shakes are offered in Chocolate and several other flavors, all very good and tasty in my humble opinion ! If you are looking for a drink with a lot of protein - 30 Grams Protein and numerous other vitamins and minerals all with NO ADDED SUGAR, try these drinks. You will be glad you did... it is a great way to begin your day or even drink at mid-day for a healthy pick-me-up. They are so easy to use in this box style container and also come in bottles. The chocolate is so delicious, try it, then try all the other flavors, like Cafe Latte, Caramel, Vanilla, Strawberry. You will be delighted with getting your nutrition in a really chocolatey drink.",en-US,"Reviewed in the United States on May 3, 2026",Flavor Name: Chocolate Size: 11 Fl Oz (Pack of 12),True,18 people found this helpful,https://www.amazon.com/dp/B008JGIZGS/,2026-06-25T11:14:33.097898+00:00,f278b31f5300c669505446f7f694d4e048ee7f802d2cbeb6a3552cbad1edd3fd
amazon,B008JGIZGS,2,R1RPYH6B2SCO6Y,LARA8,5.0,5 out of 5 stars,What's small and powerful and full of protein?,en-US,"This is better than expected - filling - chocolate-milkish taste - lots of protein - only o few calories - good for times you want to eat less but still have energy - It is a good product to have on hand - it is filling - this is not exciting but rather useful in a busy life -when you don't want to cook, before a medical procedure or any situation where less is more. The taste is good enough - best ice cold - I would recommend this product.",en-US,"Reviewed in the United States on May 15, 2026",Flavor Name: Chocolate Size: 11 Fl Oz (Pack of 12),True,5 people found this helpful,https://www.amazon.com/dp/B008JGIZGS/,2026-06-25T11:14:33.098899+00:00,88ddf0b4951a4aad9ee6546165263648448ecae07d2ef6ead81b51cd06027ef9
amazon,B008JGIZGS,3,R3FHCS7HNEK4V6,Daniel,5.0,5 out of 5 stars,Great-Tasting Protein Shake With Fresh Product Dates and Excellent Nutrition,en-US,"I picked up this Premier Protein chocolate shake 12-pack mainly as a convenient daily protein option, and overall the quality has been excellent. The chocolate flavor tastes very good without being overly sweet, and the texture is smooth compared to many protein drinks that can feel chalky or heavy. The 30 grams of protein also make it very practical for quick meals, post-workout use, or busy days when preparing food is not convenient. One thing I appreciated is that the product arrived with fresh expiration dates, which is important when buying protein drinks in bulk. The packaging was also in good condition, and the bottles were easy to store and carry. The nutritional balance is another strong point, especially with the added vitamins and minerals included without extra added sugar. Compared to many other ready-to-drink protein shakes, this one feels lighter while still being filling and satisfying. In terms of value for the money, it feels like a very good purchase considering the quality, nutrition content, convenience, and freshness. Overall, a high-quality protein shake with excellent taste, fresh product dates, strong nutritional value, and very good everyday convenience. It can also be mixed with other flavors.",en-US,"Reviewed in the United States on May 28, 2026",Flavor Name: Chocolate Size: 11 Fl Oz (Pack of 12),True,8 people found this helpful,https://www.amazon.com/dp/B008JGIZGS/,2026-06-25T11:14:33.099902+00:00,ce92d7b5d8b4da8732c33ebf1d57152d0059ec421e4827f199d8453a23dc3727
amazon,B008JGIZGS,4,R85B13FJ6NK02,Amazon Customer,5.0,5 out of 5 stars,Premier Protein Chocolate Shakes,en-US,I love these shakes. The flavor is very good. Love the amount of Protein in them. Really helps curb my appetite.,en-US,"Reviewed in the United States on June 4, 2026",Flavor Name: Chocolate Size: 11 Fl Oz (Pack of 12),True,2 people found this helpful,https://www.amazon.com/dp/B008JGIZGS/,2026-06-25T11:14:33.099902+00:00,a4a99596196507ba1a72b91c1df38d87c629be39453be3d20d5dabd9e00ac2ad
amazon,B008JGIZGS,5,R1P8YD3X8LAAWX,Amazon Customer,5.0,5 out of 5 stars,Tastes Great,en-US,"A classic chocolate shake done right.You can never go wrong with the classic chocolate flavor, and Premier Protein absolutely nails it. It is smooth, thick, and tastes like chocolate milk without any of the heavy sugar. With 30g of high-quality protein, it is my absolute go-to for daily meal replacement and muscle maintenance.",en-US,"Reviewed in the United States on June 7, 2026",Flavor Name: Chocolate Size: 11 Fl Oz (Pack of 12),True,3 people found this helpful,https://www.amazon.com/dp/B008JGIZGS/,2026-06-25T11:14:33.100898+00:00,a5fecc7b6c06dc5a1c3b8bab07c885702354bbd48d87b814f0b51414b809294a
amazon,B008JGIZGS,6,R1RET8DVF1M3JM,Penny V,4.0,4 out of 5 stars,A small drink of chocolate packs a large amount of protein,en-US,"These drinks are very convenient. I can take them with me if I’m running behind or I can just drink them here at home. The taste isn’t bad, I can handle it, but it’s not like drinking a glass of chocolate milk. The texture is quite smooth as it is already mixed up for you and it is always the same. I have never had a batch that is not been the same taste. I like that I can drink a small bit of chocolate and gain 30 g of protein.",en-US,"Reviewed in the United States on May 3, 2026",Flavor Name: Chocolate Size: 11 Fl Oz (Pack of 12),True,4 people found this helpful,https://www.amazon.com/dp/B008JGIZGS/,2026-06-25T11:14:33.102266+00:00,58091f98aef1463e764aa120ddd676850ba8d5d9cf679ea15d81aa630189f04c
amazon,B008JGIZGS,7,R2LQOPSKQUX4GQ,PAD,5.0,5 out of 5 stars,Great drink Great value,en-US,Love these drinks 30 grams of protein can’t go wrong. They taste is good the texture is not an issue. I blend mine with ice you can even put coffee in it and that is amazing. It is like a choc cappuccino. I feel better when I drink one in the morning.,en-US,"Reviewed in the United States on May 13, 2026",Flavor Name: Chocolate Size: 11 Fl Oz (Pack of 12),True,2 people found this helpful,https://www.amazon.com/dp/B008JGIZGS/,2026-06-25T11:14:33.102773+00:00,300431f5fa73c36eae5a75c26fd97af3f0877ee3ed30750a3b00c77103b88f30
amazon,B008JGIZGS,8,R1CM4NS4ID0X4Z,Charlotte L,5.0,5 out of 5 stars,Drink one every day over ice! Great taste!,en-US,"I’ve been getting Premier Protein Shake on auto delivery for a while now, and it’s one of the best decisions I’ve made for convenience and consistency. Each shake packs 30g of protein with only 1g of sugar, which makes it perfect for busy mornings or a quick post-workout boost without the guilt. ￼ The auto delivery is a game changer—no more running out or last-minute store trips. It just shows up right when I need it, and I can easily adjust or skip deliveries if needed. 📦 Taste-wise, the shakes are smooth and actually enjoyable (not chalky like some others). I’ve tried a few flavors and haven’t been disappointed yet. If you’re looking for a reliable, grab-and-go protein option with zero hassle, this subscription is 100% worth it! 💪",en-US,"Reviewed in the United States on March 22, 2026",Flavor Name: Chocolate Size: 11 Fl Oz (Pack of 12),True,14 people found this helpful,https://www.amazon.com/dp/B008JGIZGS/,2026-06-25T11:14:33.103780+00:00,6948665923f62cf93668761f3b6eedcc697d8115a8bff53a7679d1b1e47d0097
amazon,B008JGIZGS,9,R2AJHN7VFRUPQZ,Cliente de Amazon,5.0,5 out of 5 stars,Recomendado,es-MX,Muy bueno muy recomendado !!,es-MX,"Reviewed in Mexico on July 30, 2025",Flavor Name: Chocolate Size: 11 Fl Oz (Pack of 4),True,,https://www.amazon.com/dp/B008JGIZGS/,2026-06-25T11:14:33.103780+00:00,ca0f086349804b8b2a729593502f5608904d71c90431617349772121592e7f11
